{
  "$schema": "https://json-schema.org/draft/2020-12/schema",
  "title": "popular_rules_ecosystem_release_lock_v1",
  "type": "object",
  "required": [
    "schema",
    "collection",
    "source",
    "icon"
  ],
  "properties": {
    "schema": {
      "const": "popular_rules_ecosystem_release_lock_v1"
    },
    "generated_at": {
      "type": "string"
    },
    "collection": {
      "type": "object",
      "required": [
        "commit",
        "index_sha256"
      ],
      "properties": {
        "commit": {
          "type": "string"
        },
        "index_sha256": {
          "type": "string"
        },
        "run_id": {
          "type": [
            "string",
            "null"
          ]
        }
      }
    },
    "source": {
      "type": "object",
      "properties": {
        "repository": {
          "type": "string"
        },
        "persistence_commit": {},
        "run_completeness": {},
        "seal_completeness": {},
        "persisted_count": {}
      }
    },
    "icon": {
      "type": "object",
      "properties": {
        "repository": {
          "type": "string"
        },
        "branch": {
          "type": "string"
        },
        "release_id": {},
        "rollback_id": {},
        "frozen": {},
        "collection_identity_ref": {},
        "collection_identity_sha256": {},
        "identity_matches_index": {
          "type": "boolean"
        }
      }
    },
    "clients": {
      "type": "object"
    }
  }
}
