{
  "schema": "popular_rules_ecosystem_release_lock_v1",
  "generated_at": "2026-10-18T12:13:20.459237+00:00",
  "collection": {
    "commit": "898d397f1f78a658447749b739dd80a2b1e90dcf",
    "index_sha256": "b65d390b08fb27982c77540b8b1a79e783d50f6736e676f05c9d93e568c14177",
    "run_id": null
  },
  "source": {
    "repository": "cn-wanmei/Popular-Rules-Source",
    "persistence_commit": "48cf04bbf32065a53a507ca84cc85caec727cef0",
    "run_completeness": "COMPLETE",
    "seal_completeness": "COMPLETE",
    "persisted_count": 281
  },
  "icon": {
    "repository": "cn-wanmei/Popular-Rules-Icon",
    "branch": "dist",
    "release_id": "icon-2026.10.06.full1",
    "rollback_id": "icon-2026.09.30.clean1",
    "frozen": true,
    "collection_identity_ref": "cd04ff5bbda0a516370612d6dfb393eef7dc0a0b",
    "collection_identity_sha256": "b65d390b08fb27982c77540b8b1a79e783d50f6736e676f05c9d93e568c14177",
    "identity_matches_index": true
  },
  "clients": {}
}
